{
  "schemaVersion": 1,
  "id": "m1-fire-flow",
  "world": {
    "width": 1600,
    "height": 900
  },
  "protocol": {
    "warmupSeconds": 10,
    "sampleSeconds": 60,
    "expectedTickHz": 30,
    "expectedDroppedTickCount": 0,
    "totalTickTolerance": 1,
    "fullSecondTickMinimum": 29,
    "fullSecondTickMaximum": 31
  },
  "performanceSource": {
    "position": {
      "x": 800,
      "y": 840
    },
    "direction": {
      "x": 0,
      "y": -1
    },
    "width": 240
  },
  "performanceFullObstacleFixture": {
    "id": "m1-central-pillar",
    "fullObstacleRects": [
      {
        "x": 760,
        "y": 320,
        "width": 80,
        "height": 240,
        "obstacleValue": 1
      }
    ]
  },
  "technicalProbes": [
    {
      "id": "pillar",
      "seed": 1001,
      "source": {
        "position": {
          "x": 800,
          "y": 840
        },
        "direction": {
          "x": 0,
          "y": -1
        },
        "width": 240
      },
      "fullObstacleRects": [
        {
          "x": 760,
          "y": 320,
          "width": 80,
          "height": 240,
          "obstacleValue": 1
        }
      ],
      "circleCount": 0,
      "circleSpawnArea": {
        "x": 160,
        "y": 160,
        "width": 1280,
        "height": 580
      },
      "radius": 6,
      "velocity": {
        "x": 0,
        "y": 0
      }
    },
    {
      "id": "gap",
      "seed": 1002,
      "source": {
        "position": {
          "x": 800,
          "y": 840
        },
        "direction": {
          "x": 0,
          "y": -1
        },
        "width": 240
      },
      "fullObstacleRects": [
        {
          "x": 240,
          "y": 440,
          "width": 500,
          "height": 60,
          "obstacleValue": 1
        },
        {
          "x": 860,
          "y": 440,
          "width": 500,
          "height": 60,
          "obstacleValue": 1
        }
      ],
      "circleCount": 0,
      "circleSpawnArea": {
        "x": 160,
        "y": 160,
        "width": 1280,
        "height": 580
      },
      "radius": 6,
      "velocity": {
        "x": 0,
        "y": 0
      }
    },
    {
      "id": "crowd",
      "seed": 1003,
      "source": {
        "position": {
          "x": 800,
          "y": 840
        },
        "direction": {
          "x": 0,
          "y": -1
        },
        "width": 240
      },
      "fullObstacleRects": [],
      "circleCount": 8,
      "circleSpawnArea": {
        "x": 600,
        "y": 320,
        "width": 400,
        "height": 280
      },
      "radius": 32,
      "velocity": {
        "x": 0,
        "y": 0
      }
    }
  ],
  "performanceScenarios": [
    {
      "id": "m1-900",
      "seed": 900001,
      "activePearlCount": 900,
      "circleSpawnArea": {
        "x": 160,
        "y": 160,
        "width": 1280,
        "height": 580
      },
      "radius": 6,
      "velocity": {
        "x": 0,
        "y": -12
      },
      "fullObstacleFixtureId": "m1-central-pillar",
      "thresholds": {
        "fireFlowUpdateP95Ms": 6,
        "fireFlowUpdateMaxMs": 10,
        "minimumFpsPerFullSecond": 59
      }
    },
    {
      "id": "m1-2400",
      "seed": 2400001,
      "activePearlCount": 2400,
      "circleSpawnArea": {
        "x": 160,
        "y": 160,
        "width": 1280,
        "height": 580
      },
      "radius": 4,
      "velocity": {
        "x": 0,
        "y": -12
      },
      "fullObstacleFixtureId": "m1-central-pillar",
      "thresholds": {
        "fireFlowUpdateP95Ms": 8,
        "fireFlowUpdateMaxMs": 12,
        "minimumFpsPerFullSecond": 45
      }
    }
  ]
}
